{
  "schema_version": "1.0.0",
  "session_id": "sess_l1_0001",
  "objective_id": "obj_l1_research",
  "created_at": "2026-02-06T12:09:00Z",
  "topic_query": "Brazil taxi driver true crime case 2025",
  "normalized_sources": [
    {
      "source_id": "src_001",
      "url": "https://example.com/news/case-001",
      "source_name": "Example News",
      "source_type": "NEWS",
      "credibility_tier": "MEDIUM"
    }
  ],
  "claims": [
    {
      "claim_id": "clm_001",
      "claim_text": "Victim worked as a taxi driver.",
      "verification_status": "VERIFIED",
      "supporting_source_ids": [
        "src_001"
      ]
    }
  ],
  "visual_assets": [
    {
      "asset_id": "asset_001",
      "asset_type": "NEWS_STILL",
      "availability": "CONFIRMED"
    }
  ],
  "unresolved_questions": [],
  "research_status": "READY_FOR_L2"
}
